"biocong","speaker_state","speaker_first","title","origin_url","number","id","volume","chamber","session","speaker_last","pages","speaker_party","date","bills","bioguide_id","speaking","capitolwords_url"
"112A000055","AL","Robert","PERMISSION TO FILE PRIVILEGED REPORTS","http://origin.www.gpo.gov/fdsys/pkg/CREC-2012-05-16/html/CREC-2012-05-16-pt1-PgH2745.htm",70,"CREC-2012-05-16-pt1-PgH2745.chunk0",158,"House",2,"Aderholt","H2745","R","2012-05-16","","A000055","Madam Speaker, I ask unanimous consent that the Committee on Appropriations have until 6 p.m. on May 25, 2012 to file four privileged reports on the following:
a bill making appropriations for the Department of Homeland Security for the fiscal year ending September 30, 2013, and other purposes;
a bill making appropriations for military construction, the Department of Veterans Affairs, and related agencies for the fiscal year ending September 30, 2013, and for other purposes;
a bill making appropriations for the Department of Defense for the fiscal year ending September 30, 2013, and for other purposes;
and a bill making appropriations for the Department of State, foreign operations, and related programs for the fiscal year ending September 30, 2013, and for other purposes.","http://capitolwords.org/date/2012/05/16/H2745_permission-to-file-privileged-reports/"
"112A000055","AL","Robert","DEPARTMENT OF HOMELAND SECURITY APPROPRIATIONS ACT, 2012","http://origin.www.gpo.gov/fdsys/pkg/CREC-2011-06-01/html/CREC-2011-06-01-pt1-PgH3832-2.htm",77,"CREC-2011-06-01-pt1-PgH3832-2.chunk128",157,"House",1,"Aderholt","H3832-H3855","R","2011-06-01","","A000055","I insist on my point of order.
The CHAIR. The gentleman will state his point of order.","http://capitolwords.org/date/2011/06/01/H3832-2_department-of-homeland-security-appropriations-act/"
"112A000055","AL","Robert","CONTINUING APPROPRIATIONS ACT, 2012","http://origin.www.gpo.gov/fdsys/pkg/CREC-2011-09-21/html/CREC-2011-09-21-pt1-PgH6315.htm",141,"CREC-2011-09-21-pt1-PgH6315.chunk24",157,"House",1,"Aderholt","H6315-H6328","R","2011-09-21","","A000055","It passed the committee.","http://capitolwords.org/date/2011/09/21/H6315_continuing-appropriations-act-2012/"
"112A000055","AL","Robert","DEPARTMENT OF HOMELAND SECURITY APPROPRIATIONS ACT, 2012","http://origin.www.gpo.gov/fdsys/pkg/CREC-2011-06-01/html/CREC-2011-06-01-pt1-PgH3832-2.htm",77,"CREC-2011-06-01-pt1-PgH3832-2.chunk54",157,"House",1,"Aderholt","H3832-H3855","R","2011-06-01","","A000055","Mr. Chairman, I demand a recorded vote.
The CHAIR. Pursuant to clause 6 of rule XVIII, further proceedings on the amendment offered by the gentleman from Ohio will be postponed.","http://capitolwords.org/date/2011/06/01/H3832-2_department-of-homeland-security-appropriations-act/"
"112A000055","AL","Robert","I'M STANDING IN HONOR OF AN AMERICAN HERO, SGT JOSHUA WETZEL, 2ND INFANTRY EARTH PIGS, THE UNITED STATES ARMY","http://origin.www.gpo.gov/fdsys/pkg/CREC-2012-12-11/html/CREC-2012-12-11-pt1-PgE1897.htm",159,"CREC-2012-12-11-pt1-PgE1897.chunk0",158,"Extensions",2,"Aderholt","E1897","R","2012-12-11","","A000055","Mr. Speaker, I rise today in honor of one of Alabama's most heroic sons, Joshua Wetzel of The United States Army. While out on patrol on May 31, 2012 Joshua was almost killed in an IED explosion in Kandahar Afghanistan. While he lost his legs and suffered numerous other injuries, he never lost his faith. As he said to me the first time I met him in a hospital bed at Walter Reed, I'm still standing! And that pretty much sums up this man's will to live and can do spirit. He makes all of America proud and his town of Glencoe. With the help of his family and wonderful wife Paige, he has already made such great strides in such a short time and it's going to be hard to catch up to him. I ask that this poem penned in his honor by Albert Caswell be placed in the Record.","http://capitolwords.org/date/2012/12/11/E1897_im-standing-in-honor-of-an-american-hero-sgt-joshu/"
"112A000055","AL","Robert","DEPARTMENT OF HOMELAND SECURITY APPROPRIATIONS ACT, 2012","http://origin.www.gpo.gov/fdsys/pkg/CREC-2011-06-02/html/CREC-2011-06-02-pt1-PgH3928-2.htm",78,"CREC-2011-06-02-pt1-PgH3928-2.chunk3",157,"House",1,"Aderholt","H3928-H3936","R","2011-06-02","","A000055","Mr. Chairman, I reserve a point of order on the gentlewoman's amendment.
The Acting CHAIR. A point of order is reserved.
The gentlewoman from Wisconsin is recognized for 5 minutes.","http://capitolwords.org/date/2011/06/02/H3928-2_department-of-homeland-security-appropriations-act/"
"112A000055","AL","Robert","DEPARTMENT OF HOMELAND SECURITY APPROPRIATIONS ACT, 2012","http://origin.www.gpo.gov/fdsys/pkg/CREC-2011-06-02/html/CREC-2011-06-02-pt1-PgH3939.htm",78,"CREC-2011-06-02-pt1-PgH3939.chunk56",157,"House",1,"Aderholt","H3939-H3945","R","2011-06-02","","A000055","I yield to the gentleman from Florida.","http://capitolwords.org/date/2011/06/02/H3939_department-of-homeland-security-appropriations-act/"
"112A000055","AL","Robert","House of Representatives","http://origin.www.gpo.gov/fdsys/pkg/CREC-2011-06-01/html/CREC-2011-06-01-pt2-PgH3875.htm",77,"CREC-2011-06-01-pt2-PgH3875.chunk184",157,"House",1,"Aderholt","H3875-H3908","R","2011-06-01","","A000055","Madam Chair, I insist on my point of order.
The Acting CHAIR. The gentleman will state his point of order.","http://capitolwords.org/date/2011/06/01/H3875_house-of-representatives/"
"112A000055","AL","Robert","TODAY WE REMEMBER SEPTEMBER 11, 2001","http://origin.www.gpo.gov/fdsys/pkg/CREC-2012-09-11/html/CREC-2012-09-11-pt1-PgE1481.htm",121,"CREC-2012-09-11-pt1-PgE1481.chunk0",158,"Extensions",2,"Aderholt","E1481","R","2012-09-11","","A000055","Mr. Speaker, it has been eleven years and we shall never forget the impact that September 11, 2001 made on every American.
Today, eleven years since tragedy struck the shores of America at the hands of Osama bin Laden and his followers, we should all pause for a moment and reflect upon not only the solemness of this day, but also the strength of American ideals to overcome adversity and persevere.
Today, we should all remember the thousands of people needlessly murdered in New York, Pennsylvania, and Virginia on that faithful day; the brave first responders who rushed into harm's way without concern for the consequences; the thousands of brave men and women that have made the ultimate sacrifice in the course of the war of terror; and the thousands of security, intelligence, and law enforcement officials that continue to work tirelessly to keep our Nation safe and secure.","http://capitolwords.org/date/2012/09/11/E1481_today-we-remember-september-11-2001/"
"112A000055","AL","Robert","DEPARTMENT OF HOMELAND SECURITY APPROPRIATIONS ACT, 2012","http://origin.www.gpo.gov/fdsys/pkg/CREC-2011-06-01/html/CREC-2011-06-01-pt1-PgH3832-2.htm",77,"CREC-2011-06-01-pt1-PgH3832-2.chunk9",157,"House",1,"Aderholt","H3832-H3855","R","2011-06-01","","A000055","Mr. Chairman, I yield 5 minutes to the distinguished chairman of the full Appropriations Committee, the gentleman from Kentucky (Mr. Rogers).","http://capitolwords.org/date/2011/06/01/H3832-2_department-of-homeland-security-appropriations-act/"
